cluster,quantidade_municipios,nome_cluster,perfil,IDEB Anos Iniciais,IDEB Anos Finais,Taxa de Evasão AI,Taxa de Evasão AF,Taxa de Abandono AI,Taxa de Abandono AF
0,78,IDEB Bom e Evasão Moderada,"Municípios com bom desempenho nos IDEBs, baixas taxas de abandono e evasão moderada, representando um perfil educacional equilibrado.",5.60,4.94,1.64%,4.06%,0.11%,0.59%
1,28,Alta Taxa de Abandono,"Municípios com os maiores desafios educacionais, apresentando altas taxas de abandono, evasão elevada e IDEB abaixo da média.",4.64,3.93,2.94%,5.16%,1.68%,4.25%
2,48,IDEB Excelente e Baixo Abandono,"Municípios de excelência educacional, com os melhores IDEBs e as menores taxas de abandono e evasão, demonstrando qualidade e retenção escolar.",6.51,5.30,0.59%,2.54%,0.03%,0.11%
3,20,Baixa Evasão e Abandono Moderado,"Municípios com taxas de evasão excepcionalmente baixas, IDEB moderado e abandono controlado, indicando boa capacidade de retenção escolar.",4.84,4.20,0.47%,1.12%,0.30%,1.32%
4,50,IDEB Médio e Evasão Alta,"Municípios com IDEB na média, baixo abandono nos Anos Iniciais, mas desafios significativos na evasão e abandono nos Anos Finais.",4.75,4.20,1.47%,4.18%,0.23%,1.91%
